{
  "$schema": "http://json-schema.org/draft-07/schema#",
  "$id": "sources.schema.json",
  "title": "SourceEntry",
  "description": "A single source entry file in src/content/metadata/sources/{id}.json. Every sourceRef in topic frontmatter and quiz files must resolve to one of these entries.",
  "type": "object",
  "required": ["id", "title", "tier", "description"],
  "additionalProperties": false,
  "properties": {
      "id": {
        "type": "string",
        "pattern": "^[a-z][a-z0-9-]*[a-z0-9]$",
        "description": "Stable reference key. Naming convention: {source-type}-{identifier}. Oregon statutes: ors-chapter-{n} or ors-{n}-{section}. Oregon admin rules: oar-{division}-{chapter}. Official docs: {org}-{doc-type}-{keyword}. See docs/content-model.md §Naming Conventions."
      },
      "title": {
        "type": "string",
        "minLength": 5,
        "description": "Full title of the source as it should appear in the Sources page."
      },
      "url": {
        "type": ["string", "null"],
        "description": "Canonical URL. Null when the source is a PDF or document that may move; use description to identify retrieval method."
      },
      "tier": {
        "type": "integer",
        "enum": [1, 2],
        "description": "1 = primary: ORS, OAR, PSI CIB, official CCB pages. 2 = secondary: explanatory references that never override Tier 1. Published topics must have at least one Tier 1 source."
      },
      "description": {
        "type": "string",
        "minLength": 10,
        "description": "One sentence describing the source and its authority for this course."
      },
      "lastCheckedAt": {
        "type": ["string", "null"],
        "description": "ISO 8601 date (YYYY-MM-DD) when the URL or document was last confirmed accessible and current."
      }
  }
}
