{
  "id": "ors-chapter-701",
  "title": "ORS Chapter 701 — Construction Contractors",
  "url": null,
  "tier": 1,
  "description": "Oregon statute specifying when a written contract is required for residential construction work and what it must contain, including the CCB license number, price, dates, and right-of-rescission notice.",
  "lastCheckedAt": null
}
