{
  "id": "oar-812-003-0321",
  "title": "OAR 812-003-0321 — Notification of Changed Contractor License Status",
  "url": "https://secure.sos.state.or.us/oard/viewSingleRule.action?ruleVrsnRsn=307892",
  "tier": 1,
  "description": "CCB administrative rule requiring contractors to file a Notification of Changed Contractor License Status within 10 days after a change between exempt and nonexempt status.",
  "lastCheckedAt": "2026-04-12"
}
