{
  "id": "cpwr-construction-chart-book-7th-edition",
  "title": "CPWR Construction Chart Book (7th Edition)",
  "url": "https://www.cpwr.com/wp-content/uploads/CPWR_Construction_Chart_Book-7th.pdf",
  "tier": 2,
  "description": "Industry research reference used for contextual construction safety trends; not controlling Oregon law.",
  "lastCheckedAt": "2026-04-12"
}
