{
  "id": "oar-437-003-subdivision-c-general-safety",
  "title": "OAR 437-003 Subdivision C — General Safety and Health Provisions",
  "url": "https://osha.oregon.gov/OSHARules/div3/div3C.pdf",
  "tier": 1,
  "description": "Oregon-adopted construction general safety provisions, including accident prevention and training requirements.",
  "lastCheckedAt": "2026-04-12"
}
