{
  "id": "oregon-ccb-contractor-tools",
  "title": "Oregon CCB Contractor Tools",
  "url": "https://www.oregon.gov/ccb/pages/contractor-tools.aspx",
  "tier": 1,
  "description": "Official CCB contractor guidance hub including permit-responsibility reminders and compliance resources.",
  "lastCheckedAt": "2026-04-12"
}
