{
  "id": "oar-437-003-subdivision-x-stairways-ladders",
  "title": "OAR 437-003 Subdivision X — Stairways and Ladders",
  "url": "https://osha.oregon.gov/OSHARules/div3/div3X.pdf",
  "tier": 1,
  "description": "Oregon construction stairway and ladder safety requirements.",
  "lastCheckedAt": "2026-04-12"
}
