{
  "id": "ccb-contractor-tools",
  "title": "Oregon CCB Contractor Tools",
  "url": "https://www.oregon.gov/ccb/pages/contractor-tools.aspx",
  "tier": 1,
  "description": "Official CCB contractor guidance for required contracts, notices, cancellation rights, and compliance tools.",
  "lastCheckedAt": "2026-04-12"
}
