{
  "id": "ors-chapter-654",
  "title": "ORS Chapter 654 — Occupational Safety and Health",
  "url": "https://www.oregonlegislature.gov/bills_laws/ors/ors654.html",
  "tier": 1,
  "description": "Oregon Safe Employment Act statutes establishing broad workplace safety duties and compliance obligations.",
  "lastCheckedAt": "2026-04-12"
}
