{
  "id": "ors-83-730",
  "title": "ORS 83.730 — Written Agreement Requirements for Home Solicitation Sales",
  "url": "https://www.oregonlegislature.gov/bills_laws/ors/ors083.html",
  "tier": 1,
  "description": "Oregon statute specifying required written contents and cancellation notices for home solicitation sales.",
  "lastCheckedAt": "2026-04-12"
}
