{
  "id": "deq-asbestos-information",
  "title": "Oregon DEQ Asbestos Information",
  "url": "https://www.oregon.gov/deq/Hazards-and-Cleanup/Pages/Asbestos-Information.aspx",
  "tier": 1,
  "description": "Official DEQ asbestos program overview, including health risk summary and compliance responsibilities.",
  "lastCheckedAt": null
}
