{
  "id": "oha-lead-contractors-and-painters",
  "title": "Oregon Health Authority — Contractors and Painters (Lead RRP)",
  "url": "https://www.oregon.gov/oha/ph/healthyenvironments/healthyneighborhoods/leadpoisoning/contractorspainters/pages/index.aspx",
  "tier": 1,
  "description": "Official OHA overview of Oregon lead-based paint renovation requirements, certification, and program administration roles.",
  "lastCheckedAt": null
}
