{
  "id": "ors-701-081",
  "title": "ORS 701.081 — Residential Contractor Bond and Insurance Amounts",
  "url": "https://www.oregonlegislature.gov/bills_laws/ors/ors701.html",
  "tier": 1,
  "description": "Oregon statute setting residential endorsement-level surety bond and liability insurance minimums.",
  "lastCheckedAt": "2026-04-12"
}
