{
  "id": "epa-rrp-contractors",
  "title": "EPA Renovation, Repair and Painting Program for Contractors",
  "url": "https://www.epa.gov/lead/renovation-repair-and-painting-program-contractors",
  "tier": 2,
  "description": "Federal explanatory resource describing RRP scope and contractor responsibilities; used for context only alongside Oregon authorities.",
  "lastCheckedAt": null
}
