{
  "id": "ors-701-325",
  "title": "ORS 701.325 — Issuance of Building Permit; License Verification; Owner Statement",
  "url": "https://www.oregonlegislature.gov/bills_laws/ors/ors701.html",
  "tier": 1,
  "description": "Oregon statute that conditions certain permit issuance on valid CCB licensure status and signed applicant statements, including owner-exemption acknowledgments.",
  "lastCheckedAt": "2026-04-13"
}
