{
  "id": "oregon-dor-withholding-and-payroll-tax",
  "title": "Oregon Department of Revenue — Withholding and Payroll Tax",
  "url": "https://www.oregon.gov/dor/programs/businesses/pages/withholding-and-payroll-tax.aspx",
  "tier": 1,
  "description": "Official Oregon DOR payroll tax portal covering BIN registration, withholding duties, filing due dates, Form OQ/WR requirements, and reporting channels.",
  "lastCheckedAt": "2026-04-12"
}
