{
  "id": "oar-812-003-0200",
  "title": "OAR 812-003-0200 — Insurance Requirements",
  "url": "https://secure.sos.state.or.us/oard/displayDivisionRules.action?selectedDivision=3588",
  "tier": 1,
  "description": "CCB administrative rule specifying insurer ratings, policy conditions, and compliance requirements for contractor general liability insurance.",
  "lastCheckedAt": "2026-04-12"
}
