{
  "id": "ors-670-600",
  "title": "ORS 670.600 — Independent Contractor Defined",
  "url": "https://www.oregonlegislature.gov/bills_laws/ors/ors670.html",
  "tier": 1,
  "description": "Cross-chapter Oregon definition of independent contractor used for licensing and other compliance contexts including ORS chapter 701.",
  "lastCheckedAt": "2026-04-12"
}
