{
  "id": "oregon-bcd-jurisdiction-renewals-oar-918-020",
  "title": "Oregon BCD Jurisdiction Program Renewals (OAR 918-020)",
  "url": "https://www.oregon.gov/bcd/jurisdictions/pages/renewals.aspx",
  "tier": 1,
  "description": "Official BCD jurisdiction page describing municipal program renewals under OAR chapter 918, division 020, and four-year cycles.",
  "lastCheckedAt": "2026-04-12"
}
