{
  "id": "oar-812-012-0130",
  "title": "OAR 812-012-0130 — Consumer Notice Delivery and Proof",
  "url": "https://secure.sos.state.or.us/oard/displayDivisionRules.action?selectedDivision=3597",
  "tier": 1,
  "description": "CCB administrative rule setting delivery timing and proof-of-delivery retention requirements for consumer notices when ORS 701.305 written-contract requirements apply.",
  "lastCheckedAt": null
}
