{
  "id": "ors-701-026",
  "title": "ORS 701.026 — Subcontractor Licensing; Landscaping",
  "url": "https://www.oregonlegislature.gov/bills_laws/ors/ors701.html",
  "tier": 1,
  "description": "Oregon statute governing when a contractor may hire another contractor and requiring proper licensure/endorsement or exemption status.",
  "lastCheckedAt": "2026-04-12"
}
