{
  "id": "oar-437-division-3-construction",
  "title": "Oregon OSHA OAR Chapter 437 Division 3 — Construction (Current Rules Index)",
  "url": "https://osha.oregon.gov/rules/final/Pages/division-3.aspx",
  "tier": 1,
  "description": "Oregon OSHA construction rules index linking active subdivision texts and administrative orders.",
  "lastCheckedAt": "2026-04-12"
}
