{
  "id": "oar-812-003-0260",
  "title": "OAR 812-003-0260 — License Application Information",
  "url": "https://secure.sos.state.or.us/oard/displayDivisionRules.action?selectedDivision=3588",
  "tier": 1,
  "description": "CCB administrative rule listing information and declarations required on license applications.",
  "lastCheckedAt": "2026-04-12"
}
