{
  "id": "oregon-bcd-orsc-adoption",
  "title": "Oregon BCD — Oregon Residential Specialty Code (ORSC) Adoption",
  "url": "https://www.oregon.gov/bcd/codes-stand/Pages/orsc-adoption.aspx",
  "tier": 1,
  "description": "Official BCD page describing Oregon's residential code adoption cycle, including 2026 ORSC adoption process updates.",
  "lastCheckedAt": "2026-04-12"
}
