{
  "id": "ors-archive-2023-chapter-455-pdf",
  "title": "ORS Chapter 455 (2023 Edition Archive PDF)",
  "url": "https://www.oregonlegislature.gov/bills_laws/archive/2023ors455.pdf",
  "tier": 1,
  "description": "Official Oregon Legislature archived PDF used for extractable section text while validating ORS 455 structure and language.",
  "lastCheckedAt": "2026-04-12"
}
